{
  "schemaVersion": 1,
  "id": "DE-CASE-002",
  "introducedInMode": "basisschrift",
  "status": "normative",
  "version": "0.1.0",
  "direction": "forward",
  "source": {
    "contractPath": "docs/architecture/phase-15.1g-bskdl-basisschrift-capitalization-case-state-contract.json",
    "sourceRuleId": "DE-CASE-002",
    "section": "2.6",
    "kind": "MANDATORY_CASE_CONTEXTS",
    "normative": true,
    "executableAtAudit": false
  },
  "semantics": {
    "summary": "Case must be represented for abbreviations and units without abbreviation points, Roman numerals, and profile-dependent structuring letters.",
    "dependencies": [
      "DE-NUM-013",
      "2.6.2",
      "2.6.3"
    ]
  },
  "promotion": {
    "canonicalized": true,
    "runtimeDisposition": "NOT_CLASSIFIED",
    "lossless": true,
    "runtimeOwner": null,
    "notes": []
  },
  "conformance": {
    "validationCaseIds": [
      "DE-CASE-CASE-003"
    ]
  },
  "notes": []
}
