{
  "schemaVersion": 1,
  "id": "DE-CB-010",
  "introducedInMode": "basisschrift",
  "status": "normative",
  "version": "0.1.0",
  "direction": "forward",
  "source": {
    "contractPath": "docs/architecture/phase-15.1l-bskdl-basisschrift-computerbraille-insert-six-dot-transport-contract.json",
    "sourceRuleId": "DE-CB-010",
    "section": "2.11",
    "kind": "BLANK_CONTAINING_INSERT_START",
    "normative": true,
    "executableAtAudit": false
  },
  "semantics": {
    "summary": "A Computerbraille insert whose serialized form contains at least one Braille blank uses the blank-containing announcement marker.",
    "marker": {
      "unicode": "⠨⠨",
      "codepoints": [
        "U+2828",
        "U+2828"
      ],
      "dots": [
        "46",
        "46"
      ],
      "cellCount": 2
    },
    "selectionKey": "SERIALIZED_BRAILLE_CONTAINS_BLANK",
    "selectionValue": true
  },
  "promotion": {
    "canonicalized": true,
    "runtimeDisposition": "NOT_CLASSIFIED",
    "lossless": true,
    "runtimeOwner": null,
    "notes": []
  },
  "conformance": {
    "validationCaseIds": [
      "DE-CB-CASE-010",
      "DE-CB-CASE-011"
    ]
  },
  "notes": []
}
