{
  "schemaVersion": 1,
  "id": "DE-STROKE-004",
  "introducedInMode": "basisschrift",
  "status": "normative",
  "version": "0.1.0",
  "direction": "forward",
  "source": {
    "contractPath": "docs/architecture/phase-15.1f-bskdl-basisschrift-stroke-slash-boundary-contract.json",
    "sourceRuleId": "DE-STROKE-004",
    "section": "2.5.1.3",
    "kind": "OMISSION_DASH",
    "normative": true,
    "executableAtAudit": false
  },
  "semantics": {
    "printRole": "AUSLASSUNGSSTRICH",
    "braille": {
      "unicode": "⠠⠤",
      "codepoints": [
        "U+2820",
        "U+2824"
      ],
      "dots": [
        "6",
        "36"
      ],
      "cellCount": 2
    },
    "summary": "The same extended dash sequence represents a missing entry in a table.",
    "context": "TABLE_MISSING_ENTRY"
  },
  "promotion": {
    "canonicalized": true,
    "runtimeDisposition": "NOT_CLASSIFIED",
    "lossless": true,
    "runtimeOwner": null,
    "notes": []
  },
  "conformance": {
    "validationCaseIds": []
  },
  "notes": []
}
