{
  "schemaVersion": 1,
  "id": "DE-STROKE-016",
  "introducedInMode": "basisschrift",
  "status": "normative",
  "version": "0.1.0",
  "direction": "forward",
  "source": {
    "contractPath": "docs/architecture/phase-15.1f-bskdl-basisschrift-stroke-slash-boundary-contract.json",
    "sourceRuleId": "DE-STROKE-016",
    "section": "2.5.3",
    "kind": "VERTICAL_SEPARATOR",
    "normative": true,
    "executableAtAudit": false
  },
  "semantics": {
    "braille": {
      "unicode": "⠐⠤",
      "codepoints": [
        "U+2810",
        "U+2824"
      ],
      "dots": [
        "5",
        "36"
      ],
      "cellCount": 2
    },
    "summary": "A vertical print separator used to distinguish terms or concepts maps to the secondary separator sequence.",
    "spacing": {
      "conceptSeparator": "SURROUNDED_BY_BLANKS",
      "wordSplitMarker": "NO_BLANKS"
    }
  },
  "promotion": {
    "canonicalized": true,
    "runtimeDisposition": "NOT_CLASSIFIED",
    "lossless": true,
    "runtimeOwner": null,
    "notes": []
  },
  "conformance": {
    "validationCaseIds": [
      "DE-STROKE-CASE-006"
    ]
  },
  "notes": []
}
