{
  "schemaVersion": 1,
  "id": "DE-EMPH-007",
  "introducedInMode": "basisschrift",
  "status": "normative",
  "version": "0.1.0",
  "direction": "forward",
  "source": {
    "contractPath": "docs/architecture/phase-15.1h-bskdl-basisschrift-emphasis-versalien-contract.json",
    "sourceRuleId": "DE-EMPH-007",
    "section": "2.7.2",
    "kind": "SECONDARY_SINGLE_WORD_OR_PART",
    "normative": true,
    "executableAtAudit": false
  },
  "semantics": {
    "marker": {
      "unicode": "⠐⠸",
      "codepoints": [
        "U+2810",
        "U+2838"
      ],
      "dots": [
        "5",
        "456"
      ],
      "cellCount": 2
    },
    "summary": "The second emphasis type uses its alternate marker for one word and for the start of a highlighted word part."
  },
  "promotion": {
    "canonicalized": true,
    "runtimeDisposition": "NOT_CLASSIFIED",
    "lossless": true,
    "runtimeOwner": null,
    "notes": []
  },
  "conformance": {
    "validationCaseIds": [
      "DE-EMPH-CASE-005"
    ]
  },
  "notes": []
}
